{"schema_version":1,"core":"fmsx","display_name":"Microsoft - MSX (fMSX)","reviewed_at":"2026-09-12","core_info_file":"fmsx_libretro.info","hosts":{"linux":{"status":"unverified","reason":"Exact current RetroArch core package availability on Linux was not separately verified.","evidence":["records/retroarch.json host paths","official per-core distribution not separately verified"]},"linux-flatpak":{"status":"unverified","reason":"Exact current RetroArch Flatpak core package availability was not separately verified.","evidence":["records/retroarch.json host paths","official per-core distribution not separately verified"]},"macos":{"status":"unverified","reason":"Exact current RetroArch core package availability on macOS was not separately verified.","evidence":["records/retroarch.json host paths","official per-core distribution not separately verified"]},"windows":{"status":"unverified","reason":"Exact current RetroArch core package availability on Windows was not separately verified.","evidence":["records/retroarch.json host paths","official per-core distribution not separately verified"]}},"controller":{"status":"contracted","profile_ids":["retroarch:fmsx:predefined-keyboard","retroarch:fmsx:joysticks","retroarch:fmsx:joystick-keyboard-shortcuts"],"mapping_summary":"Catalogued controller contract for Microsoft - MSX (fMSX); profile IDs identify the exact input layouts available to Lunchpail.","evidence":["catalog.json: retroarch:fmsx:predefined-keyboard, retroarch:fmsx:joysticks, retroarch:fmsx:joystick-keyboard-shortcuts","fmsx_libretro.info core identity"]},"firmware":{"status":"mixed","files":[{"path":"MSX.ROM","description":"MSX.ROM (MSX BIOS)","required":true,"checksum_status":"published","checksums":[{"algorithm":"md5","value":"364a1a579fe5cb8dba54519bcfcdac0d","source":"fmsx_libretro.info notes at 2e8b29be1683344e7a69b3dc4af1c0da88415def"}],"evidence":["fmsx_libretro.info firmware0_path/firmware0_opt/notes"]},{"path":"MSX2.ROM","description":"MSX2.ROM (MSX2 BIOS)","required":true,"checksum_status":"published","checksums":[{"algorithm":"md5","value":"ec3a01c91f24fbddcbcab0ad301bc9ef","source":"fmsx_libretro.info notes at 2e8b29be1683344e7a69b3dc4af1c0da88415def"}],"evidence":["fmsx_libretro.info firmware1_path/firmware1_opt/notes"]},{"path":"MSX2EXT.ROM","description":"MSX2EXT.ROM (MSX2 ExtROM)","required":true,"checksum_status":"published","checksums":[{"algorithm":"md5","value":"2183c2aff17cf4297bdb496de78c2e8a","source":"fmsx_libretro.info notes at 2e8b29be1683344e7a69b3dc4af1c0da88415def"}],"evidence":["fmsx_libretro.info firmware2_path/firmware2_opt/notes"]},{"path":"MSX2P.ROM","description":"MSX2P.ROM (MSX2+ BIOS)","required":true,"checksum_status":"published","checksums":[{"algorithm":"md5","value":"847cc025ffae665487940ff2639540e5","source":"fmsx_libretro.info notes at 2e8b29be1683344e7a69b3dc4af1c0da88415def"}],"evidence":["fmsx_libretro.info firmware3_path/firmware3_opt/notes"]},{"path":"MSX2PEXT.ROM","description":"MSX2PEXT.ROM (MSX2+ ExtROM)","required":true,"checksum_status":"published","checksums":[{"algorithm":"md5","value":"7c8243c71d8f143b2531f01afa6a05dc","source":"fmsx_libretro.info notes at 2e8b29be1683344e7a69b3dc4af1c0da88415def"}],"evidence":["fmsx_libretro.info firmware4_path/firmware4_opt/notes"]},{"path":"DISK.ROM","description":"DISK.ROM (DiskROM/BDOS)","required":false,"checksum_status":"published","checksums":[{"algorithm":"md5","value":"80dcd1ad1a4cf65d64b7ba10504e8190","source":"fmsx_libretro.info notes at 2e8b29be1683344e7a69b3dc4af1c0da88415def"}],"evidence":["fmsx_libretro.info firmware5_path/firmware5_opt/notes"]},{"path":"FMPAC.ROM","description":"FMPAC.ROM (FMPAC BIOS)","required":false,"checksum_status":"published","checksums":[{"algorithm":"md5","value":"6f69cc8b5ed761b03afd78000dfb0e19","source":"fmsx_libretro.info notes at 2e8b29be1683344e7a69b3dc4af1c0da88415def"}],"evidence":["fmsx_libretro.info firmware6_path/firmware6_opt/notes"]},{"path":"MSXDOS2.ROM","description":"MSXDOS2.ROM (MSX-DOS 2)","required":false,"checksum_status":"published","checksums":[{"algorithm":"md5","value":"6418d091cd6907bbcf940324339e43bb","source":"fmsx_libretro.info notes at 2e8b29be1683344e7a69b3dc4af1c0da88415def"}],"evidence":["fmsx_libretro.info firmware7_path/firmware7_opt/notes"]},{"path":"PAINTER.ROM","description":"PAINTER.ROM (Yamaha Painter)","required":false,"checksum_status":"published","checksums":[{"algorithm":"md5","value":"403cdea1cbd2bb24fae506941f8f655e","source":"fmsx_libretro.info notes at 2e8b29be1683344e7a69b3dc4af1c0da88415def"}],"evidence":["fmsx_libretro.info firmware8_path/firmware8_opt/notes"]},{"path":"KANJI.ROM","description":"KANJI.ROM (Kanji Font)","required":false,"checksum_status":"published","checksums":[{"algorithm":"md5","value":"febe8782b466d7c3b16de6d104826b34","source":"fmsx_libretro.info notes at 2e8b29be1683344e7a69b3dc4af1c0da88415def"}],"evidence":["fmsx_libretro.info firmware9_path/firmware9_opt/notes"]}],"notes":"Core-info declares 10 firmware path(s); requiredness follows firmware*_opt and any published digest is recorded per file.","evidence":["pinned libretro-core-info revision 2e8b29be1683344e7a69b3dc4af1c0da88415def","fmsx_libretro.info firmware metadata"]},"saves":{"status":"unknown","extensions":[],"naming":"The pinned core-info metadata does not declare libretro_saves; no persistent-save artifact or filename extension is claimed.","notes":"Persistent-save behavior remains unknown without revision-pinned core source evidence.","evidence":["fmsx_libretro.info libretro_saves=absent"]},"states":{"status":"unknown","serialization":"unknown","naming":"The pinned core-info record does not establish state support or serialization detail.","notes":"Core-info does not declare a usable savestate capability.","evidence":["fmsx_libretro.info savestate=not declared/savestate_features=not declared"]}}
