{"schema_version":1,"core":"quasi88","display_name":"NEC - PC-88 series (QUASI88)","reviewed_at":"2026-09-12","core_info_file":"quasi88_libretro.info","controller":{"status":"contracted","profile_ids":["retroarch:quasi88:n88-v2-keyboard","retroarch:quasi88:n88-v1h-keyboard","retroarch:quasi88:n88-v1s-keyboard","retroarch:quasi88:n-keyboard"],"mapping_summary":"QUASI88 keyboard profile maps the PC-8801 keyboard/action matrix through the retropad contract.","evidence":["catalog.json: retroarch:quasi88:n-keyboard","quasi88-libretro libretro.c pinned source"]},"firmware":{"status":"mixed","files":[{"path":"quasi88/n88.rom","description":"PC-8801 main BIOS","required":true,"checksum_status":"not_published","checksums":[],"evidence":["quasi88_libretro.info firmware0_path/firmware0_opt"]},{"path":"quasi88/n88_0.rom","description":"PC-8801 extension BIOS","required":true,"checksum_status":"not_published","checksums":[],"evidence":["quasi88_libretro.info firmware1_path/firmware1_opt"]},{"path":"quasi88/n88_1.rom","description":"PC-8801 extension BIOS","required":false,"checksum_status":"not_published","checksums":[],"evidence":["quasi88_libretro.info firmware2_path/firmware2_opt"]},{"path":"quasi88/n88_2.rom","description":"PC-8801 extension BIOS","required":false,"checksum_status":"not_published","checksums":[],"evidence":["quasi88_libretro.info firmware3_path/firmware3_opt"]},{"path":"quasi88/n88_3.rom","description":"PC-8801 extension BIOS","required":false,"checksum_status":"not_published","checksums":[],"evidence":["quasi88_libretro.info firmware4_path/firmware4_opt"]},{"path":"quasi88/n88n.rom","description":"N Basic BIOS","required":false,"checksum_status":"not_published","checksums":[],"evidence":["quasi88_libretro.info firmware5_path/firmware5_opt"]},{"path":"quasi88/disk.rom","description":"Disk sub-BIOS","required":false,"checksum_status":"not_published","checksums":[],"evidence":["quasi88_libretro.info firmware6_path/firmware6_opt"]},{"path":"quasi88/n88knj1.rom","description":"Kanji font 1","required":false,"checksum_status":"not_published","checksums":[],"evidence":["quasi88_libretro.info firmware7_path/firmware7_opt"]},{"path":"quasi88/n88knj2.rom","description":"Kanji font 2","required":false,"checksum_status":"not_published","checksums":[],"evidence":["quasi88_libretro.info firmware8_path/firmware8_opt"]},{"path":"quasi88/n88jisho.rom","description":"Jisho ROM","required":false,"checksum_status":"not_published","checksums":[],"evidence":["quasi88_libretro.info firmware9_path/firmware9_opt"]}],"notes":"Core-info gives exact system/quasi88 paths and requiredness; no canonical digests are published.","evidence":["quasi88_libretro.info firmware_count/firmware*_path/firmware*_opt"]},"saves":{"status":"supported","extensions":[".srm"],"naming":"RetroArch content-basename save files for persistent PC-88 disk/media state where supported.","notes":"Disk image contents may also contain software-defined saves.","evidence":["quasi88 upstream libretro save handling","docs:Libretro save conventions"]},"states":{"status":"supported","serialization":"deterministic","naming":"Frontend state names are <content-basename>.state and <content-basename>.stateN.","notes":"quasi88_libretro.info declares deterministic savestates.","evidence":["quasi88_libretro.info savestate=true/savestate_features=deterministic"]},"hosts":{"linux":{"status":"unverified","reason":"Exact current RetroArch core package availability on Linux was not separately verified.","evidence":["records/retroarch.json host paths","official per-core distribution not separately verified"]},"linux-flatpak":{"status":"unverified","reason":"Exact current RetroArch Flatpak core package availability was not separately verified.","evidence":["records/retroarch.json host paths","official per-core distribution not separately verified"]},"macos":{"status":"unverified","reason":"Exact current RetroArch core package availability on macOS was not separately verified.","evidence":["records/retroarch.json host paths","official per-core distribution not separately verified"]},"windows":{"status":"unverified","reason":"Exact current RetroArch core package availability on Windows was not separately verified.","evidence":["records/retroarch.json host paths","official per-core distribution not separately verified"]}}}
