{"schema_version":1,"core":"gambatte","display_name":"Nintendo - Game Boy / Color (Gambatte)","reviewed_at":"2026-09-12","core_info_file":"gambatte_libretro.info","hosts":{"linux":{"status":"available","reason":"The official Libretro Linux x86_64 buildbot artifact was downloaded and executed through the exact-core Game Boy input oracle.","evidence":["buildbot:https://buildbot.libretro.com/nightly/linux/x86_64/latest/gambatte_libretro.so.zip @2026-09-12","runtime:Linux x86_64; Gambatte v0.5.0-netlink d9d6cd0; sha256 b8fba61ecbb840723a7c64d771196b37931c50ba4d98874cccedfd69a8aa27a6","crates/lunchpail-controller-probe/LIBRETRO_INPUT.md"]},"linux-flatpak":{"status":"unverified","reason":"Exact current RetroArch Flatpak core package availability was not separately verified.","evidence":["records/retroarch.json host paths","official per-core distribution not separately verified"]},"macos":{"status":"available","reason":"The official Libretro macOS arm64 buildbot artifact was downloaded and executed through the exact-core Game Boy input oracle on an Apple Silicon host.","evidence":["buildbot:https://buildbot.libretro.com/nightly/apple/osx/arm64/latest/gambatte_libretro.dylib.zip @2026-09-12","runtime:macOS 26.5.1 arm64; Gambatte v0.5.0-netlink d9d6cd0; sha256 19f088f910a89ffef80a26766f682dd01aa5ae81c95adca6926a3d9c10733a50","crates/lunchpail-controller-probe/LIBRETRO_INPUT.md"]},"windows":{"status":"available","reason":"The official Libretro Windows x86_64 buildbot artifact was downloaded and executed through the exact-core Game Boy input oracle on a GitHub-hosted Windows Server 2025 VM.","evidence":["buildbot:https://buildbot.libretro.com/nightly/windows/x86_64/latest/gambatte_libretro.dll.zip @2026-09-12","runtime:Windows Server 2025 x86_64; Gambatte v0.5.0-netlink d9d6cd0; sha256 c15eb6dc323b08610e8241ace11135d9fe8e1c8a3190541394f15457cdac59e1","github-actions:https://github.com/benwbooth/lunchpail/actions/runs/34742154324","crates/lunchpail-controller-probe/LIBRETRO_INPUT.md"]}},"controller":{"status":"contracted","profile_ids":["retroarch:gambatte:gameboy"],"mapping_summary":"Catalogued controller contract for Nintendo - Game Boy / Color (Gambatte); profile IDs identify the exact input layouts available to Lunchpail.","evidence":["catalog.json: retroarch:gambatte:gameboy","gambatte_libretro.info core identity"]},"firmware":{"status":"optional","files":[{"path":"gb_bios.bin","description":"gb_bios.bin (Game Boy BIOS)","required":false,"checksum_status":"published","checksums":[{"algorithm":"md5","value":"32fbbd84168d3482956eb3c5051637f5","source":"gambatte_libretro.info notes at 2e8b29be1683344e7a69b3dc4af1c0da88415def"}],"evidence":["gambatte_libretro.info firmware0_path/firmware0_opt/notes"]},{"path":"gbc_bios.bin","description":"gbc_bios.bin (Game Boy Color BIOS)","required":false,"checksum_status":"published","checksums":[{"algorithm":"md5","value":"dbfce9db9deaa2567f6a84fde55f9680","source":"gambatte_libretro.info notes at 2e8b29be1683344e7a69b3dc4af1c0da88415def"}],"evidence":["gambatte_libretro.info firmware1_path/firmware1_opt/notes"]}],"notes":"Core-info declares 2 firmware path(s); requiredness follows firmware*_opt and any published digest is recorded per file.","evidence":["pinned libretro-core-info revision 2e8b29be1683344e7a69b3dc4af1c0da88415def","gambatte_libretro.info firmware metadata"]},"saves":{"status":"unknown","extensions":[],"naming":"The pinned core-info metadata does not declare libretro_saves; no persistent-save artifact or filename extension is claimed.","notes":"Persistent-save behavior remains unknown without revision-pinned core source evidence.","evidence":["gambatte_libretro.info libretro_saves=absent"]},"states":{"status":"supported","serialization":"deterministic","naming":"RetroArch frontend state names are <content-basename>.state and <content-basename>.stateN for slots.","notes":"Core-info declares savestate support (deterministic).","evidence":["gambatte_libretro.info savestate=true/savestate_features=deterministic"]}}
