{"schema_version":1,"core":"ardens","display_name":"Arduboy (Ardens)","reviewed_at":"2026-09-12","core_info_file":"ardens_libretro.info","hosts":{"linux":{"status":"unverified","reason":"Exact current RetroArch core package availability on Linux was not separately verified.","evidence":["records/retroarch.json host paths","official per-core distribution not separately verified"]},"linux-flatpak":{"status":"unverified","reason":"Exact current RetroArch Flatpak core package availability was not separately verified.","evidence":["records/retroarch.json host paths","official per-core distribution not separately verified"]},"macos":{"status":"unverified","reason":"Exact current RetroArch core package availability on macOS was not separately verified.","evidence":["records/retroarch.json host paths","official per-core distribution not separately verified"]},"windows":{"status":"unverified","reason":"Exact current RetroArch core package availability on Windows was not separately verified.","evidence":["records/retroarch.json host paths","official per-core distribution not separately verified"]}},"controller":{"status":"contracted","profile_ids":["retroarch:ardens:arduboy"],"mapping_summary":"Catalogued controller contract for Arduboy (Ardens); profile IDs identify the exact input layouts available to Lunchpail.","evidence":["catalog.json: retroarch:ardens:arduboy","ardens_libretro.info core identity"]},"firmware":{"status":"not_required","files":[],"notes":"The pinned core-info record declares no firmware files.","evidence":["pinned libretro-core-info revision 2e8b29be1683344e7a69b3dc4af1c0da88415def","ardens_libretro.info firmware metadata"]},"saves":{"status":"unknown","extensions":[],"naming":"The pinned core-info metadata does not declare libretro_saves; no persistent-save artifact or filename extension is claimed.","notes":"Persistent-save behavior remains unknown without revision-pinned core source evidence.","evidence":["ardens_libretro.info libretro_saves=absent"]},"states":{"status":"supported","serialization":"unknown","naming":"RetroArch frontend state names are <content-basename>.state and <content-basename>.stateN for slots.","notes":"Core-info declares savestate support.","evidence":["ardens_libretro.info savestate=true/savestate_features=not declared"]}}
