{
  "schema_version": 1,
  "core": "snes9x",
  "display_name": "Nintendo - SNES / SFC (Snes9x)",
  "reviewed_at": "2026-09-12",
  "core_info_file": "snes9x_libretro.info",
  "controller": {
    "status": "contracted",
    "profile_ids": [
      "retroarch:snes9x:snes"
    ],
    "mapping_summary": "SNES retropad profile maps the two SNES controller ports, face buttons, shoulders and D-pad.",
    "evidence": [
      "catalog.json controller profile"
    ]
  },
  "firmware": {
    "status": "optional",
    "files": [
      {
        "path": "BS-X.bin",
        "description": "BS-X.bin (BS-X - Sore wa Namae o Nusumareta Machi no Monogatari (Japan) (Rev 1))",
        "required": false,
        "checksum_status": "published",
        "checksums": [
          {
            "algorithm": "md5",
            "value": "fed4d8242cfbed61343d53d48432aced",
            "source": "snes9x_libretro.info firmware path/optional/notes at 2e8b29be1683344e7a69b3dc4af1c0da88415def"
          }
        ],
        "evidence": [
          "snes9x_libretro.info firmware path/optional/notes"
        ]
      },
      {
        "path": "STBIOS.bin",
        "description": "STBIOS.bin (Sufami Turbo (Japan))",
        "required": false,
        "checksum_status": "published",
        "checksums": [
          {
            "algorithm": "md5",
            "value": "d3a44ba7d42a74d3ac58cb9c14c6a5ca",
            "source": "snes9x_libretro.info firmware path/optional/notes at 2e8b29be1683344e7a69b3dc4af1c0da88415def"
          }
        ],
        "evidence": [
          "snes9x_libretro.info firmware path/optional/notes"
        ]
      }
    ],
    "notes": "BS-X.bin and STBIOS.bin are optional special-media BIOS files; ordinary SNES cartridges need neither.",
    "evidence": [
      "snes9x_libretro.info firmware_count/firmware*_path/firmware*_opt/notes at 2e8b29be1683344e7a69b3dc4af1c0da88415def"
    ]
  },
  "saves": {
    "status": "supported",
    "extensions": [],
    "naming": "The pinned core-info metadata declares libretro_saves=true but does not declare a persistent-save filename extension.",
    "notes": "Persistent save support is declared by the pinned core-info metadata; filename and content semantics are not specified there.",
    "evidence": [
      "snes9x_libretro.info libretro_saves=true"
    ]
  },
  "states": {
    "status": "supported",
    "serialization": "deterministic",
    "naming": "Frontend state names are <content-basename>.state and <content-basename>.stateN.",
    "notes": "snes9x_libretro.info declares deterministic savestates.",
    "evidence": [
      "snes9x_libretro.info savestate=true/savestate_features=deterministic"
    ]
  },
  "hosts": {
    "linux": {
      "status": "unverified",
      "reason": "Exact current RetroArch core package availability on Linux was not separately verified.",
      "evidence": [
        "records/retroarch.json host paths",
        "official per-core distribution not separately verified"
      ]
    },
    "linux-flatpak": {
      "status": "available",
      "reason": "The installed RetroArch Flatpak-updater core was loaded and executed through exact-hash direct-core probes.",
      "evidence": [
        "ledger:emulator_details/runtime-test-results.json retroarch:snes9x/linux-flatpak",
        "identity:2026-09-12 installed Flatpak-updater direct-core probe: Snes9x 1.63 185488c, snes9x_libretro.so sha256 6e2d5fb3bbf57ef0a24834b36914187bea1a0b20f373da3adfdd5aebf75a4a99."
      ]
    },
    "macos": {
      "status": "available",
      "reason": "The official Libretro macOS arm64 buildbot artifact was downloaded and executed on an Apple Silicon host.",
      "evidence": [
        "buildbot:https://buildbot.libretro.com/nightly/apple/osx/arm64/latest/snes9x_libretro.dylib.zip @2026-09-12",
        "runtime:macOS 26.5.1 arm64; Snes9x 1.63 890b5d4; sha256 0f8fe5bf4e9ee72f8a73b00439884126c5358b98f4509fd19dd3d7aac26b3e54"
      ]
    },
    "windows": {
      "status": "available",
      "reason": "The official Libretro Windows x86_64 buildbot artifact was downloaded and executed on a GitHub-hosted Windows Server 2025 VM.",
      "evidence": [
        "buildbot:https://buildbot.libretro.com/nightly/windows/x86_64/latest/snes9x_libretro.dll.zip @2026-09-12",
        "runtime:Windows Server 2025 x86_64; Snes9x 1.63 890b5d4; sha256 9a7e9401efe087eab04a22c47f0fb71ae9381aabd761db22a5ccb18f42ccdf1e",
        "github-actions:https://github.com/benwbooth/lunchpail/actions/runs/34739017401"
      ]
    }
  }
}
