{"schema_version":1,"core":"nestopia","display_name":"Nintendo - NES / Famicom (Nestopia)","reviewed_at":"2026-09-12","core_info_file":"nestopia_libretro.info","hosts":{"linux":{"status":"unverified","reason":"Pinned core-info identifies the core but does not establish a current host-specific package; RetroArch frontend presence alone is not package evidence.","evidence":["core-info:nestopia_libretro.info @2e8b29be1683344e7a69b3dc4af1c0da88415def"]},"linux-flatpak":{"status":"available","reason":"The installed RetroArch Flatpak-updater core was loaded and executed through exact-hash frontend and direct-core probes inside the installed Flatpak runtime.","evidence":["ledger:emulator_details/runtime-test-results.json retroarch:nestopia/linux-flatpak","identity:2026-09-12/13 installed RetroArch Flatpak 1.22.2 Git 69a4f0ea1e, commit 9c51e2bcb6f7f29ecb327ee057b273c5b59efc22d35026e90aef601bc0052752; installed updater Nestopia core sha256 3d517a4aa301b37d9d65e2a984e7d4e4db2fae7ccdad17abed7093316f2efec4."]},"macos":{"status":"available","reason":"The official Libretro macOS arm64 buildbot core was downloaded and executed on an Apple Silicon host.","evidence":["ledger:emulator_details/runtime-test-results.json retroarch:nestopia/macos","identity:2026-09-13 macOS 26.5.1 arm64 M1 direct-core audit: official Libretro archive sha256 4b7b07895ff4595a5fb0ad705608f333b7008f960314129aa4bb5bcd79a29cdf contained Nestopia 1.99.0 5265136, nestopia_libretro.dylib sha256 31bdba996461c5214e706ca1c674138976f6932af0a4da1de431b031cf706540."]},"windows":{"status":"available","reason":"The official Libretro Windows x86_64 buildbot artifact was downloaded and executed on a GitHub-hosted Windows Server 2025 VM.","evidence":["ledger:emulator_details/runtime-test-results.json retroarch:nestopia/windows","identity:2026-09-13 GitHub-hosted Windows Server 2025 x86_64 direct-core audit: official Libretro buildbot archive sha256 54f1652c9fa8cb8974cc526cbc1da74acb86f87e10f22c8ddc1e8bd2a913093e contained Nestopia 1.99.0 5265136, nestopia_libretro.dll sha256 58445c86e4f1858bbe5a68eb4f7b120419f1418a1a9f7743d81076321fafa296."]}},"controller":{"status":"contracted","profile_ids":["retroarch:nestopia:nes-2player","retroarch:nestopia:nes-4player"],"mapping_summary":"Catalog retropad profiles map the system controls to the core’s libretro input ports.","evidence":["crates/lunchpail-app/data/controllers/catalog.json emulator_profiles","core-info:nestopia_libretro.info"]},"firmware":{"status":"optional","files":[{"path":"disksys.rom","description":"disksys.rom (Family Computer Disk System BIOS)","required":false,"checksum_status":"published","checksums":[{"algorithm":"md5","value":"ca30b50f880eb660a320674ed365ef7a","source":"nestopia_libretro.info notes @2e8b29be1683344e7a69b3dc4af1c0da88415def"}],"evidence":["nestopia_libretro.info firmware0_path/firmware0_opt"]}],"notes":"nestopia_libretro.info supplies the canonical firmware paths and optionality; hashes are included only where the pinned notes publish them.","evidence":["core-info:nestopia_libretro.info firmware_count/firmware*_path/firmware*_opt @2e8b29be1683344e7a69b3dc4af1c0da88415def"]},"saves":{"status":"supported","extensions":[],"naming":"The pinned core-info metadata declares libretro_saves=true but does not declare a persistent-save filename extension.","notes":"Persistent save support is declared by the pinned core-info metadata; filename and content semantics are not specified there.","evidence":["nestopia_libretro.info libretro_saves=true"]},"states":{"status":"supported","serialization":"deterministic","naming":"<content-basename>.state for slot 0 and <content-basename>.stateN for numbered slots; RetroArch may place these under its configured states directory.","notes":"nestopia_libretro.info declares savestate=true with deterministic serialization.","evidence":["nestopia_libretro.info savestate=true/savestate_features=deterministic"]}}
