{"schema_version":1,"core":"gearcoleco","display_name":"Coleco - ColecoVision (Gearcoleco)","reviewed_at":"2026-09-12","core_info_file":"gearcoleco_libretro.info","hosts":{"linux":{"status":"unverified","reason":"Exact current RetroArch core package availability on Linux was not separately verified.","evidence":["records/retroarch.json host paths","official per-core distribution not separately verified"]},"linux-flatpak":{"status":"unverified","reason":"Exact current RetroArch Flatpak core package availability was not separately verified.","evidence":["records/retroarch.json host paths","official per-core distribution not separately verified"]},"macos":{"status":"unverified","reason":"Exact current RetroArch core package availability on macOS was not separately verified.","evidence":["records/retroarch.json host paths","official per-core distribution not separately verified"]},"windows":{"status":"unverified","reason":"Exact current RetroArch core package availability on Windows was not separately verified.","evidence":["records/retroarch.json host paths","official per-core distribution not separately verified"]}},"controller":{"status":"contracted","profile_ids":["retroarch:gearcoleco:standard-controllers"],"mapping_summary":"Catalogued controller contract for Coleco - ColecoVision (Gearcoleco); profile IDs identify the exact input layouts available to Lunchpail.","evidence":["catalog.json: retroarch:gearcoleco:standard-controllers","gearcoleco_libretro.info core identity"]},"firmware":{"status":"required","files":[{"path":"colecovision.rom","description":"colecovision.rom (ColecoVision BIOS)","required":true,"checksum_status":"published","checksums":[{"algorithm":"md5","value":"2c66f5911e5b42b8ebe113403548eee7","source":"gearcoleco_libretro.info notes at 2e8b29be1683344e7a69b3dc4af1c0da88415def"}],"evidence":["gearcoleco_libretro.info firmware0_path/firmware0_opt/notes"]}],"notes":"Core-info declares 1 firmware path(s); requiredness follows firmware*_opt and any published digest is recorded per file.","evidence":["pinned libretro-core-info revision 2e8b29be1683344e7a69b3dc4af1c0da88415def","gearcoleco_libretro.info firmware metadata"]},"saves":{"status":"not_supported","extensions":[],"naming":"The pinned core-info metadata declares libretro_saves=false; no standalone RetroArch persistent save artifact is claimed.","notes":"No libretro persistent-save interface is declared by the pinned core-info metadata.","evidence":["gearcoleco_libretro.info libretro_saves=false"]},"states":{"status":"supported","serialization":"deterministic","naming":"RetroArch frontend state names are <content-basename>.state and <content-basename>.stateN for slots.","notes":"Core-info declares savestate support (deterministic).","evidence":["gearcoleco_libretro.info savestate=true/savestate_features=deterministic"]}}
