{"schema_version":1,"core":"mesen-s","display_name":"Nintendo - SNES / SFC / Game Boy / Color (Mesen-S)","reviewed_at":"2026-09-12","core_info_file":"mesen-s_libretro.info","hosts":{"linux":{"status":"unverified","reason":"Pinned core-info identifies the core but does not establish a current host-specific package; RetroArch frontend presence alone is not package evidence.","evidence":["core-info:mesen-s_libretro.info @2e8b29be1683344e7a69b3dc4af1c0da88415def"]},"linux-flatpak":{"status":"available","reason":"The installed RetroArch Flatpak-updater core was loaded and executed through exact-hash direct-core probes.","evidence":["ledger:emulator_details/runtime-test-results.json retroarch:mesen-s/linux-flatpak","identity:2026-09-12 installed Flatpak-updater direct-core probe: Mesen-S 0.4.0, mesen_s_libretro.so sha256 d43d7875316dc3f505ec160d5d34cc541fa899225c9227fed839697a7936cb5a."]},"macos":{"status":"unavailable","reason":"The official Libretro buildbot did not publish Mesen-S at the current macOS arm64, universal, or legacy current paths; all three exact artifact requests returned HTTP 404 on the Apple Silicon audit host.","evidence":["buildbot:https://buildbot.libretro.com/nightly/apple/osx/arm64/latest/mesen_s_libretro.dylib.zip returned HTTP 404 @2026-09-12","buildbot:https://buildbot.libretro.com/nightly/apple/osx/universal/latest/mesen_s_libretro.dylib.zip returned HTTP 404 @2026-09-12","buildbot:https://buildbot.libretro.com/nightly/apple/osx/x86_64/latest/mesen_s_libretro.dylib.zip returned HTTP 404 @2026-09-12"]},"windows":{"status":"unavailable","reason":"The official Libretro Windows x86_64 buildbot did not publish Mesen-S at the current artifact path; the exact request returned HTTP 404 on a hosted Windows Server 2025 VM.","evidence":["buildbot:https://buildbot.libretro.com/nightly/windows/x86_64/latest/mesen_s_libretro.dll.zip returned HTTP 404 @2026-09-12","github-actions:https://github.com/benwbooth/lunchpail/actions/runs/34739661776"]}},"controller":{"status":"contracted","profile_ids":["retroarch:mesen-s:snes-2player","retroarch:mesen-s:snes-4player-multitap"],"mapping_summary":"Catalog retropad profiles map the system controls to the core’s libretro input ports.","evidence":["crates/lunchpail-app/data/controllers/catalog.json emulator_profiles","core-info:mesen-s_libretro.info"]},"firmware":{"status":"optional","files":[{"path":"dsp1.data.rom","description":"dsp1.data.rom","required":false,"checksum_status":"not_published","checksums":[],"evidence":["mesen-s_libretro.info firmware0_path/firmware0_opt"]},{"path":"dsp1.program.rom","description":"dsp1.program.rom","required":false,"checksum_status":"not_published","checksums":[],"evidence":["mesen-s_libretro.info firmware1_path/firmware1_opt"]},{"path":"dsp1b.data.rom","description":"dsp1b.data.rom","required":false,"checksum_status":"not_published","checksums":[],"evidence":["mesen-s_libretro.info firmware2_path/firmware2_opt"]},{"path":"dsp1b.program.rom","description":"dsp1b.program.rom","required":false,"checksum_status":"not_published","checksums":[],"evidence":["mesen-s_libretro.info firmware3_path/firmware3_opt"]},{"path":"dsp2.data.rom","description":"dsp2.data.rom","required":false,"checksum_status":"not_published","checksums":[],"evidence":["mesen-s_libretro.info firmware4_path/firmware4_opt"]},{"path":"dsp2.program.rom","description":"dsp2.program.rom","required":false,"checksum_status":"not_published","checksums":[],"evidence":["mesen-s_libretro.info firmware5_path/firmware5_opt"]},{"path":"dsp3.data.rom","description":"dsp3.data.rom","required":false,"checksum_status":"not_published","checksums":[],"evidence":["mesen-s_libretro.info firmware6_path/firmware6_opt"]},{"path":"dsp3.program.rom","description":"dsp3.program.rom","required":false,"checksum_status":"not_published","checksums":[],"evidence":["mesen-s_libretro.info firmware7_path/firmware7_opt"]},{"path":"dsp4.data.rom","description":"dsp4.data.rom","required":false,"checksum_status":"not_published","checksums":[],"evidence":["mesen-s_libretro.info firmware8_path/firmware8_opt"]},{"path":"dsp4.program.rom","description":"dsp4.program.rom","required":false,"checksum_status":"not_published","checksums":[],"evidence":["mesen-s_libretro.info firmware9_path/firmware9_opt"]},{"path":"st010.data.rom","description":"st010.data.rom","required":false,"checksum_status":"not_published","checksums":[],"evidence":["mesen-s_libretro.info firmware10_path/firmware10_opt"]},{"path":"st010.program.rom","description":"st010.program.rom","required":false,"checksum_status":"not_published","checksums":[],"evidence":["mesen-s_libretro.info firmware11_path/firmware11_opt"]},{"path":"st011.data.rom","description":"st011.data.rom","required":false,"checksum_status":"not_published","checksums":[],"evidence":["mesen-s_libretro.info firmware12_path/firmware12_opt"]},{"path":"st011.program.rom","description":"st011.program.rom","required":false,"checksum_status":"not_published","checksums":[],"evidence":["mesen-s_libretro.info firmware13_path/firmware13_opt"]},{"path":"dmg_boot.bin","description":"dmg_boot.bin (GB Boot Image)","required":false,"checksum_status":"not_published","checksums":[],"evidence":["mesen-s_libretro.info firmware14_path/firmware14_opt"]},{"path":"cgb_boot.bin","description":"cgb_boot.bin (GBC Boot Image)","required":false,"checksum_status":"not_published","checksums":[],"evidence":["mesen-s_libretro.info firmware15_path/firmware15_opt"]},{"path":"sgb_boot.bin","description":"sgb_boot.bin (SGB Boot Image)","required":false,"checksum_status":"not_published","checksums":[],"evidence":["mesen-s_libretro.info firmware16_path/firmware16_opt"]},{"path":"sgb2_boot.bin","description":"sgb2_boot.bin (SGB2 Boot Image)","required":false,"checksum_status":"not_published","checksums":[],"evidence":["mesen-s_libretro.info firmware17_path/firmware17_opt"]},{"path":"SGB1.sfc","description":"SGB1.sfc (SGB ROM)","required":false,"checksum_status":"not_published","checksums":[],"evidence":["mesen-s_libretro.info firmware18_path/firmware18_opt"]},{"path":"SGB2.sfc","description":"SGB2.sfc (SGB2 ROM)","required":false,"checksum_status":"not_published","checksums":[],"evidence":["mesen-s_libretro.info firmware19_path/firmware19_opt"]},{"path":"BS-X.bin","description":"BS-X.bin (Satellaview Boot ROM)","required":false,"checksum_status":"not_published","checksums":[],"evidence":["mesen-s_libretro.info firmware20_path/firmware20_opt"]}],"notes":"mesen-s_libretro.info supplies the canonical firmware paths and optionality; hashes are included only where the pinned notes publish them.","evidence":["core-info:mesen-s_libretro.info firmware_count/firmware*_path/firmware*_opt @2e8b29be1683344e7a69b3dc4af1c0da88415def"]},"saves":{"status":"unknown","extensions":[],"naming":"The pinned core-info metadata does not declare libretro_saves; no persistent-save artifact or filename extension is claimed.","notes":"Persistent-save behavior remains unknown without revision-pinned core source evidence.","evidence":["mesen-s_libretro.info libretro_saves=absent"]},"states":{"status":"unknown","serialization":"unknown","naming":"No core-info savestate capability is declared; no portable state filename is asserted.","notes":"mesen-s_libretro.info does not declare savestate capability in the pinned core-info record.","evidence":["mesen-s_libretro.info savestate field absent"]}}
