{"schema_version":1,"core":"mednafen_supergrafx","display_name":"NEC - PC Engine SuperGrafx (Beetle SuperGrafx)","reviewed_at":"2026-09-12","core_info_file":"mednafen_supergrafx_libretro.info","hosts":{"linux":{"status":"unverified","reason":"Pinned core-info identifies the core but does not establish a current host-specific package; RetroArch frontend presence alone is not package evidence.","evidence":["core-info:mednafen_supergrafx_libretro.info @2e8b29be1683344e7a69b3dc4af1c0da88415def"]},"linux-flatpak":{"status":"unverified","reason":"Pinned core-info identifies the core but does not establish a current host-specific package; RetroArch frontend presence alone is not package evidence.","evidence":["core-info:mednafen_supergrafx_libretro.info @2e8b29be1683344e7a69b3dc4af1c0da88415def"]},"macos":{"status":"unverified","reason":"Pinned core-info identifies the core but does not establish a current host-specific package; RetroArch frontend presence alone is not package evidence.","evidence":["core-info:mednafen_supergrafx_libretro.info @2e8b29be1683344e7a69b3dc4af1c0da88415def"]},"windows":{"status":"unverified","reason":"Pinned core-info identifies the core but does not establish a current host-specific package; RetroArch frontend presence alone is not package evidence.","evidence":["core-info:mednafen_supergrafx_libretro.info @2e8b29be1683344e7a69b3dc4af1c0da88415def"]}},"controller":{"status":"contracted","profile_ids":["retroarch:mednafen_supergrafx:pce2","retroarch:mednafen_supergrafx:pce6-1player","retroarch:mednafen_supergrafx:pce6-5player"],"mapping_summary":"Catalog retropad profiles map the system controls to the core’s libretro input ports.","evidence":["crates/lunchpail-app/data/controllers/catalog.json emulator_profiles","core-info:mednafen_supergrafx_libretro.info"]},"firmware":{"status":"optional","files":[{"path":"syscard3.pce","description":"syscard3.pce (Super CD-ROM2 System V3.xx)","required":false,"checksum_status":"published","checksums":[{"algorithm":"md5","value":"38179df8f4ac870017db21ebcbf53114","source":"mednafen_supergrafx_libretro.info notes @2e8b29be1683344e7a69b3dc4af1c0da88415def"}],"evidence":["mednafen_supergrafx_libretro.info firmware0_path/firmware0_opt"]},{"path":"syscard2.pce","description":"syscard2.pce (CD-ROM System V2.xx)","required":false,"checksum_status":"not_published","checksums":[],"evidence":["mednafen_supergrafx_libretro.info firmware1_path/firmware1_opt"]},{"path":"syscard1.pce","description":"syscard1.pce (CD-ROM System V1.xx)","required":false,"checksum_status":"not_published","checksums":[],"evidence":["mednafen_supergrafx_libretro.info firmware2_path/firmware2_opt"]},{"path":"gexpress.pce","description":"gexpress.pce (Game Express CD Card)","required":false,"checksum_status":"not_published","checksums":[],"evidence":["mednafen_supergrafx_libretro.info firmware3_path/firmware3_opt"]}],"notes":"mednafen_supergrafx_libretro.info supplies the canonical firmware paths and optionality; hashes are included only where the pinned notes publish them.","evidence":["core-info:mednafen_supergrafx_libretro.info firmware_count/firmware*_path/firmware*_opt @2e8b29be1683344e7a69b3dc4af1c0da88415def"]},"saves":{"status":"supported","extensions":[],"naming":"The pinned core-info metadata declares libretro_saves=true but does not declare a persistent-save filename extension.","notes":"Persistent save support is declared by the pinned core-info metadata; filename and content semantics are not specified there.","evidence":["mednafen_supergrafx_libretro.info libretro_saves=true"]},"states":{"status":"supported","serialization":"deterministic","naming":"<content-basename>.state for slot 0 and <content-basename>.stateN for numbered slots; RetroArch may place these under its configured states directory.","notes":"mednafen_supergrafx_libretro.info declares savestate=true with deterministic serialization.","evidence":["mednafen_supergrafx_libretro.info savestate=true/savestate_features=deterministic"]}}
