{"schema_version":1,"core":"mesen","display_name":"Nintendo - NES / Famicom (Mesen)","reviewed_at":"2026-09-12","core_info_file":"mesen_libretro.info","hosts":{"linux":{"status":"unverified","reason":"Pinned core-info identifies the core but does not establish a current host-specific package; RetroArch frontend presence alone is not package evidence.","evidence":["core-info:mesen_libretro.info @2e8b29be1683344e7a69b3dc4af1c0da88415def"]},"linux-flatpak":{"status":"available","reason":"The installed RetroArch Flatpak-updater core was loaded and executed through exact-hash direct-core probes.","evidence":["ledger:emulator_details/runtime-test-results.json retroarch:mesen/linux-flatpak","identity:2026-09-12: installed Mesen 0.9.9 core, mesen_libretro.so sha256 552f8ab6ac1fd08bd555f589eb999be73a469c79ccfa929f884adb2cf3366b43."]},"macos":{"status":"available","reason":"The official Libretro macOS arm64 buildbot artifact was downloaded and executed on an Apple Silicon host.","evidence":["buildbot:https://buildbot.libretro.com/nightly/apple/osx/arm64/latest/mesen_libretro.dylib.zip @2026-09-12","runtime:macOS 26.5.1 arm64; Mesen 0.9.9; sha256 3849098df9baf3b37fb58e27049c05d39ff4c4ffa63f0d739294188ba601c5d5"]},"windows":{"status":"available","reason":"The official Libretro Windows x86_64 buildbot artifact was downloaded and executed on a GitHub-hosted Windows Server 2025 VM.","evidence":["buildbot:https://buildbot.libretro.com/nightly/windows/x86_64/latest/mesen_libretro.dll.zip @2026-09-12","runtime:Windows Server 2025 x86_64; Mesen 0.9.9; sha256 53f3ebc11e4287c37b01cc53d3dc7975116ca5e99e73727425e5762f96353d9f","github-actions:https://github.com/benwbooth/lunchpail/actions/runs/34739017401"]}},"controller":{"status":"contracted","profile_ids":["retroarch:mesen:nes-2player","retroarch:mesen:nes-4player"],"mapping_summary":"Catalog retropad profiles map the system controls to the core’s libretro input ports.","evidence":["crates/lunchpail-app/data/controllers/catalog.json emulator_profiles","core-info:mesen_libretro.info"]},"firmware":{"status":"optional","files":[{"path":"disksys.rom","description":"disksys.rom (Family Computer Disk System BIOS)","required":false,"checksum_status":"published","checksums":[{"algorithm":"md5","value":"ca30b50f880eb660a320674ed365ef7a","source":"mesen_libretro.info notes @2e8b29be1683344e7a69b3dc4af1c0da88415def"}],"evidence":["mesen_libretro.info firmware0_path/firmware0_opt"]}],"notes":"mesen_libretro.info supplies the canonical firmware paths and optionality; hashes are included only where the pinned notes publish them.","evidence":["core-info:mesen_libretro.info firmware_count/firmware*_path/firmware*_opt @2e8b29be1683344e7a69b3dc4af1c0da88415def"]},"saves":{"status":"supported","extensions":[],"naming":"The pinned core-info metadata declares libretro_saves=true but does not declare a persistent-save filename extension.","notes":"Persistent save support is declared by the pinned core-info metadata; filename and content semantics are not specified there.","evidence":["mesen_libretro.info libretro_saves=true"]},"states":{"status":"supported","serialization":"deterministic","naming":"<content-basename>.state for slot 0 and <content-basename>.stateN for numbered slots; RetroArch may place these under its configured states directory.","notes":"mesen_libretro.info declares savestate=true with deterministic serialization.","evidence":["mesen_libretro.info savestate=true/savestate_features=deterministic"]}}
