{"schema_version":1,"core":"genesis_plus_gx","display_name":"Sega - MS/GG/MD/CD (Genesis Plus GX)","reviewed_at":"2026-09-12","core_info_file":"genesis_plus_gx_libretro.info","hosts":{"linux":{"status":"available","reason":"The official Libretro Linux x86_64 buildbot core was loaded and executed through exact-hash direct-core probes.","evidence":["ledger:emulator_details/runtime-test-results.json retroarch:genesis_plus_gx/linux","identity:2026-09-12 native Linux direct-core probe: official buildbot Genesis Plus GX v1.7.4 c2838c7, genesis_plus_gx_libretro.so sha256 30abab06a9e1cfc26766a864fab83ee986cec1d6156c48dec13f9d03b46b2a6c."]},"linux-flatpak":{"status":"unverified","reason":"Exact current RetroArch Flatpak core package availability was not separately verified.","evidence":["records/retroarch.json host paths","official per-core distribution not separately verified"]},"macos":{"status":"available","reason":"The official Libretro macOS arm64 buildbot artifact was downloaded and executed on an Apple Silicon host.","evidence":["buildbot:https://buildbot.libretro.com/nightly/apple/osx/arm64/latest/genesis_plus_gx_libretro.dylib.zip @2026-09-12","runtime:macOS 26.5.1 arm64; Genesis Plus GX v1.7.4 c2838c7; sha256 0f4367774eddca7f6eb569648f9adc85cd62662577184634034be326199500d3"]},"windows":{"status":"available","reason":"The official Libretro Windows x86_64 buildbot artifact was downloaded and executed on a GitHub-hosted Windows Server 2025 VM.","evidence":["buildbot:https://buildbot.libretro.com/nightly/windows/x86_64/latest/genesis_plus_gx_libretro.dll.zip @2026-09-12","runtime:Windows Server 2025 x86_64; Genesis Plus GX v1.7.4 c2838c7; sha256 c53e9ef8fcb72f85d574ed2d0a4dc963a425586f1cd0039ee06ad381e6a4afc3","github-actions:https://github.com/benwbooth/lunchpail/actions/runs/34739017401"]}},"controller":{"status":"contracted","profile_ids":["retroarch:genesis_plus_gx:md3","retroarch:genesis_plus_gx:md6","retroarch:genesis_plus_gx:gamegear"],"mapping_summary":"Catalogued controller contract for Sega - MS/GG/MD/CD (Genesis Plus GX); profile IDs identify the exact input layouts available to Lunchpail.","evidence":["catalog.json: retroarch:genesis_plus_gx:md3, retroarch:genesis_plus_gx:md6, retroarch:genesis_plus_gx:gamegear","genesis_plus_gx_libretro.info core identity"]},"firmware":{"status":"optional","files":[{"path":"bios_MD.bin","description":"bios_MD.bin (Mega Drive startup ROM)","required":false,"checksum_status":"not_published","checksums":[],"evidence":["genesis_plus_gx_libretro.info firmware0_path/firmware0_opt"]},{"path":"bios_CD_E.bin","description":"bios_CD_E.bin (MegaCD EU BIOS)","required":false,"checksum_status":"not_published","checksums":[],"evidence":["genesis_plus_gx_libretro.info firmware1_path/firmware1_opt"]},{"path":"bios_CD_U.bin","description":"bios_CD_U.bin (SegaCD US BIOS)","required":false,"checksum_status":"not_published","checksums":[],"evidence":["genesis_plus_gx_libretro.info firmware2_path/firmware2_opt"]},{"path":"bios_CD_J.bin","description":"bios_CD_J.bin (MegaCD JP BIOS)","required":false,"checksum_status":"not_published","checksums":[],"evidence":["genesis_plus_gx_libretro.info firmware3_path/firmware3_opt"]},{"path":"bios_E.sms","description":"bios_E.sms (MasterSystem EU BIOS)","required":false,"checksum_status":"not_published","checksums":[],"evidence":["genesis_plus_gx_libretro.info firmware4_path/firmware4_opt"]},{"path":"bios_U.sms","description":"bios_U.sms (MasterSystem US BIOS)","required":false,"checksum_status":"not_published","checksums":[],"evidence":["genesis_plus_gx_libretro.info firmware5_path/firmware5_opt"]},{"path":"bios_J.sms","description":"bios_J.sms (MasterSystem JP BIOS)","required":false,"checksum_status":"not_published","checksums":[],"evidence":["genesis_plus_gx_libretro.info firmware6_path/firmware6_opt"]},{"path":"bios.gg","description":"bios.gg (GameGear BIOS)","required":false,"checksum_status":"not_published","checksums":[],"evidence":["genesis_plus_gx_libretro.info firmware7_path/firmware7_opt"]},{"path":"sk.bin","description":"sk.bin (Sonic & Knuckles ROM)","required":false,"checksum_status":"published","checksums":[{"algorithm":"md5","value":"4ea493ea4e9f6c9ebfccbdb15110367e","source":"genesis_plus_gx_libretro.info notes at 2e8b29be1683344e7a69b3dc4af1c0da88415def"}],"evidence":["genesis_plus_gx_libretro.info firmware8_path/firmware8_opt/notes"]},{"path":"sk2chip.bin","description":"sk2chip.bin (Sonic & Knuckles UPMEM ROM)","required":false,"checksum_status":"published","checksums":[{"algorithm":"md5","value":"b4e76e416b887f4e7413ba76fa735f16","source":"genesis_plus_gx_libretro.info notes at 2e8b29be1683344e7a69b3dc4af1c0da88415def"}],"evidence":["genesis_plus_gx_libretro.info firmware9_path/firmware9_opt/notes"]},{"path":"areplay.bin","description":"areplay.bin (Action Replay ROM)","required":false,"checksum_status":"not_published","checksums":[],"evidence":["genesis_plus_gx_libretro.info firmware10_path/firmware10_opt"]},{"path":"ggenie.bin","description":"ggenie.bin (Game Genie ROM)","required":false,"checksum_status":"not_published","checksums":[],"evidence":["genesis_plus_gx_libretro.info firmware11_path/firmware11_opt"]}],"notes":"Core-info declares 12 firmware path(s); requiredness follows firmware*_opt and any published digest is recorded per file.","evidence":["pinned libretro-core-info revision 2e8b29be1683344e7a69b3dc4af1c0da88415def","genesis_plus_gx_libretro.info firmware metadata"]},"saves":{"status":"supported","extensions":[],"naming":"The pinned core-info metadata declares libretro_saves=true but does not declare a persistent-save filename extension.","notes":"Persistent save support is declared by the pinned core-info metadata; filename and content semantics are not specified there.","evidence":["genesis_plus_gx_libretro.info libretro_saves=true"]},"states":{"status":"supported","serialization":"deterministic","naming":"RetroArch frontend state names are <content-basename>.state and <content-basename>.stateN for slots.","notes":"Core-info declares savestate support (deterministic).","evidence":["genesis_plus_gx_libretro.info savestate=true/savestate_features=deterministic"]}}
