{"schema_version":1,"core":"mame","display_name":"Arcade (MAME)","reviewed_at":"2026-09-12","core_info_file":"mame_libretro.info","hosts":{"linux":{"status":"unverified","reason":"Pinned core-info identifies the core but does not establish a current host-specific package; RetroArch frontend presence alone is not package evidence.","evidence":["core-info:mame_libretro.info @2e8b29be1683344e7a69b3dc4af1c0da88415def"]},"linux-flatpak":{"status":"available","reason":"The installed RetroArch Flatpak-updater core was loaded and executed through exact-hash input and state oracles on the Linux host.","evidence":["runtime:MAME 0.287 (a891bc3b); sha256 8bcc096667a3c24baefece40b610f981a5c8de13447af486b0ad9381e28302e7 @2026-09-12","crates/lunchpail-controller-probe/LIBRETRO_ARCADE_ORACLE.md"]},"macos":{"status":"available","reason":"The official Libretro macOS arm64 buildbot artifact was downloaded and executed on an Apple Silicon host.","evidence":["buildbot:https://buildbot.libretro.com/nightly/apple/osx/arm64/latest/mame_libretro.dylib.zip @2026-09-12","runtime:MAME 0.289 (4fc9a931); sha256 de43859a4ab93ea7a1df3f920ae7b2657212b7357b31e6ed72754394198baa4b"]},"windows":{"status":"available","reason":"The official Libretro Windows x86_64 buildbot artifact and DLL identity were verified on a GitHub-hosted Windows Server 2025 VM; feature execution remained separately blocked by unavailable game content.","evidence":["ledger:emulator_details/runtime-test-results.json retroarch:mame/windows","identity:2026-09-13 GitHub-hosted Windows Server 2025 x86_64 identity audit: the official Libretro archive matched pinned sha256 77d38183ba995e8bb3e2f514e680d30645eae3b8aad78d6b62026d166c664590, and its MAME 0.289 (4fc9a931) DLL matched sha256 b38c9ebb2cf679745701569c511f9c381e1f4f3f43e0212fe728397b0badbead plus the expected full-path/block-extract metadata."]}},"controller":{"status":"contracted","profile_ids":["retroarch:mame:arcade-6","retroarch:mame:arcade-8"],"mapping_summary":"Catalog retropad profiles map the system controls to the core’s libretro input ports.","evidence":["crates/lunchpail-app/data/controllers/catalog.json emulator_profiles","core-info:mame_libretro.info"]},"firmware":{"status":"not_required","files":[],"notes":"mame_libretro.info supplies the canonical firmware paths and optionality; hashes are included only where the pinned notes publish them.","evidence":["core-info:mame_libretro.info firmware_count/firmware*_path/firmware*_opt @2e8b29be1683344e7a69b3dc4af1c0da88415def"]},"saves":{"status":"not_supported","extensions":[],"naming":"The pinned core-info metadata declares libretro_saves=false; no standalone RetroArch persistent save artifact is claimed.","notes":"No libretro persistent-save interface is declared by the pinned core-info metadata.","evidence":["mame_libretro.info libretro_saves=false"]},"states":{"status":"supported","serialization":"deterministic","naming":"<content-basename>.state for slot 0 and <content-basename>.stateN for numbered slots; RetroArch may place these under its configured states directory.","notes":"mame_libretro.info declares savestate=true with deterministic serialization.","evidence":["mame_libretro.info savestate=true/savestate_features=deterministic"]}}
