{"schema_version":1,"core":"px68k","display_name":"Sharp - X68000 (PX68k)","reviewed_at":"2026-09-12","core_info_file":"px68k_libretro.info","controller":{"status":"contracted","profile_ids":["retroarch:px68k:cyberstick-analog","retroarch:px68k:cyberstick-analog-with-two-button","retroarch:px68k:cyberstick-analog-with-cpsf-md","retroarch:px68k:cyberstick-analog-with-cpsf-sfc","retroarch:px68k:two-button-with-cpsf-md","retroarch:px68k:two-button-with-cpsf-sfc","retroarch:px68k:cpsf-md-with-two-button","retroarch:px68k:cpsf-md-with-cpsf-sfc","retroarch:px68k:cpsf-sfc-with-two-button","retroarch:px68k:cpsf-sfc-with-cpsf-md","retroarch:px68k:cyberstick-digital-with-two-button","retroarch:px68k:cyberstick-digital-with-cpsf-md","retroarch:px68k:cyberstick-digital-with-cpsf-sfc","retroarch:px68k:two-button","retroarch:px68k:cpsf-md","retroarch:px68k:cpsf-sfc","retroarch:px68k:cyberstick-digital"],"mapping_summary":"PX68k profiles cover two-button pads and CyberStick analog/digital controls; core options choose joystick type and virtual-button layout.","evidence":["catalog.json: PX68k retropad profiles","px68k-libretro joystick.c pinned source"]},"firmware":{"status":"mixed","files":[{"path":"keropi/iplrom.dat","description":"X68000 IPL ROM","required":true,"checksum_status":"not_published","checksums":[],"evidence":["px68k_libretro.info firmware0_path/firmware0_opt"]},{"path":"keropi/cgrom.dat","description":"X68000 character ROM","required":true,"checksum_status":"not_published","checksums":[],"evidence":["px68k_libretro.info firmware1_path/firmware1_opt"]},{"path":"keropi/iplrom30.dat","description":"X68000 version 3 IPL ROM","required":false,"checksum_status":"not_published","checksums":[],"evidence":["px68k_libretro.info firmware2_path/firmware2_opt"]}],"notes":"Place BIOS files in system/keropi; core-info publishes names/requiredness but no canonical digests.","evidence":["px68k_libretro.info notes and firmware paths"]},"saves":{"status":"supported","extensions":[".srm"],"naming":"RetroArch uses content-basename persistent save files for PX68k SRAM/NVRAM where the loaded software exposes it.","notes":"Disk images retain their own names; persistent memory is content-dependent.","evidence":["px68k-libretro save implementation","docs:Libretro PX68k"]},"states":{"status":"supported","serialization":"serialized","naming":"Frontend state names are <content-basename>.state and <content-basename>.stateN.","notes":"PX68k core-info declares savestates.","evidence":["px68k_libretro.info savestate=true"]},"hosts":{"linux":{"status":"unverified","reason":"Exact current RetroArch core package availability on Linux was not separately verified.","evidence":["records/retroarch.json host paths","official per-core distribution not separately verified"]},"linux-flatpak":{"status":"unverified","reason":"Exact current RetroArch Flatpak core package availability was not separately verified.","evidence":["records/retroarch.json host paths","official per-core distribution not separately verified"]},"macos":{"status":"unverified","reason":"Exact current RetroArch core package availability on macOS was not separately verified.","evidence":["records/retroarch.json host paths","official per-core distribution not separately verified"]},"windows":{"status":"unverified","reason":"Exact current RetroArch core package availability on Windows was not separately verified.","evidence":["records/retroarch.json host paths","official per-core distribution not separately verified"]}}}
