{"schema_version":1,"core":"same_cdi","display_name":"Philips - CDi (SAME CDi)","reviewed_at":"2026-09-12","core_info_file":"same_cdi_libretro.info","controller":{"status":"contracted","profile_ids":["retroarch:same-cdi:stick-pointer","retroarch:same-cdi:dpad-pointer"],"mapping_summary":"SAME CDi profiles map the CD-i pointer through either d-pad or analog-stick retropad semantics; face buttons provide mouse/button actions.","evidence":["catalog.json: same_cdi retropad profiles","same_cdi input_retro.cpp pinned source"]},"firmware":{"status":"mixed","files":[{"path":"same_cdi/bios/cdimono1.zip","description":"same_cdi/bios/cdimono1.zip","required":true,"checksum_status":"not_published","checksums":[],"evidence":["same_cdi_libretro.info firmware0_path/firmware0_opt"]},{"path":"same_cdi/bios/cdimono2.zip","description":"same_cdi/bios/cdimono2.zip","required":false,"checksum_status":"not_published","checksums":[],"evidence":["same_cdi_libretro.info firmware1_path/firmware1_opt"]},{"path":"same_cdi/bios/cdibios.zip","description":"same_cdi/bios/cdibios.zip","required":false,"checksum_status":"not_published","checksums":[],"evidence":["same_cdi_libretro.info firmware2_path/firmware2_opt"]}],"notes":"Core-info gives exact ZIP paths and requiredness but publishes no canonical digests.","evidence":["same_cdi_libretro.info firmware_count/firmware*_path/firmware*_opt"]},"saves":{"status":"not_supported","extensions":[],"naming":"The pinned core-info metadata declares libretro_saves=false; no standalone RetroArch persistent save artifact is claimed.","notes":"No libretro persistent-save interface is declared by the pinned core-info metadata.","evidence":["same_cdi_libretro.info libretro_saves=false"]},"states":{"status":"not_supported","serialization":"none","naming":"same_cdi_libretro.info declares savestate=false.","notes":"No core save-state serialization is available.","evidence":["same_cdi_libretro.info savestate=false/savestate_features=null"]},"hosts":{"linux":{"status":"unverified","reason":"Exact current RetroArch core package availability on Linux was not separately verified.","evidence":["records/retroarch.json host paths","official per-core distribution not separately verified"]},"linux-flatpak":{"status":"unverified","reason":"Exact current RetroArch Flatpak core package availability was not separately verified.","evidence":["records/retroarch.json host paths","official per-core distribution not separately verified"]},"macos":{"status":"unverified","reason":"Exact current RetroArch core package availability on macOS was not separately verified.","evidence":["records/retroarch.json host paths","official per-core distribution not separately verified"]},"windows":{"status":"unverified","reason":"Exact current RetroArch core package availability on Windows was not separately verified.","evidence":["records/retroarch.json host paths","official per-core distribution not separately verified"]}}}
